{
  "id": "umbral_chapel",
  "name": "Umbral Chapel",
  "templatePrefix": "umbral",
  "assetFolder": "umbral",
  "roomCount": {
    "min": 8,
    "max": 10
  },
  "roomTemplateIds": [
    "umbral_entrance",
    "umbral_stairs",
    "umbral_corridor",
    "umbral_courtyard",
    "umbral_hall",
    "umbral_treasure",
    "umbral_secret",
    "umbral_arena",
    "umbral_boss",
    "umbral_puzzle",
    "umbral_corridor_long",
    "umbral_corridor_bend",
    "umbral_balcony"
  ],
  "materials": {
    "floor": "umbral",
    "wall": "umbral",
    "ceiling": "umbral",
    "accent": "umbral"
  },
  "lighting": {
    "ambientColor": [
      0.18,
      0.12,
      0.26
    ],
    "ambientEnergy": 0.34,
    "fogEnabled": true,
    "fogColor": [
      0.06,
      0.04,
      0.1
    ],
    "fogDensity": 0.024,
    "torchColor": [
      0.35,
      0.2,
      0.45
    ],
    "torchEnergy": 1.9
  },
  "audioProfile": "content/audio_profiles/umbral_chapel.json",
  "propKit": {
    "pillar": "res://scenes/props/umbral/pillar.tscn",
    "sconce": "res://scenes/props/umbral/sconce.tscn",
    "rubble": [
      "res://scenes/props/umbral/rubble_a.tscn",
      "res://scenes/props/umbral/rubble_b.tscn"
    ]
  },
  "enemyPool": [
    {
      "enemyId": "umbral_penitent",
      "weight": 3,
      "minFloor": 1
    },
    {
      "enemyId": "umbral_censer",
      "weight": 2,
      "minFloor": 1
    },
    {
      "enemyId": "umbral_cowl",
      "weight": 2,
      "minFloor": 2
    },
    {
      "enemyId": "umbral_reliquary_golem",
      "weight": 2,
      "minFloor": 3
    },
    {
      "enemyId": "umbral_confessor",
      "weight": 1,
      "minFloor": 3
    }
  ],
  "roleComposition": {
    "melee": 0.6,
    "ranged": 0.4
  },
  "bossPool": [
    {
      "enemyId": "umbral_hierarch",
      "weight": 3
    },
    {
      "enemyId": "umbral_confessor",
      "weight": 1
    }
  ],
  "minibossPool": [
    {
      "enemyId": "umbral_confessor",
      "weight": 1
    }
  ],
  "budgets": {
    "baseEnemyThreat": 100,
    "baseLootValue": 60,
    "threatPerTier": 20,
    "lootPerTier": 10
  },
  "lootTables": {
    "treasure": [
      {
        "itemId": "health_potion",
        "quantity": [
          2,
          3
        ],
        "weight": 3
      },
      {
        "itemId": "shadow_relic_veil",
        "quantity": [
          1,
          1
        ],
        "weight": 2
      }
    ],
    "secret": [
      {
        "itemId": "shadow_relic_veil",
        "quantity": [
          1,
          1
        ],
        "weight": 2
      },
      {
        "itemId": "health_potion",
        "quantity": [
          3,
          4
        ],
        "weight": 3
      }
    ],
    "side": [
      {
        "itemId": "cathedral_warden_helm",
        "quantity": [
          1,
          1
        ],
        "weight": 2
      },
      {
        "itemId": "sun_relic_medallion",
        "quantity": [
          1,
          1
        ],
        "weight": 2
      }
    ],
    "armory": [
      {
        "itemId": "cathedral_arcane_staff",
        "quantity": [
          1,
          1
        ],
        "weight": 1
      }
    ]
  },
  "trapPool": [
    {
      "trapId": "shadow_trap",
      "weight": 3
    },
    {
      "trapId": "rot_censer",
      "weight": 2
    },
    {
      "trapId": "ember_grate",
      "weight": 2
    },
    {
      "trapId": "swinging_blade",
      "weight": 2
    },
    {
      "trapId": "bone_snare",
      "weight": 2
    }
  ],
  "grade": {
    "shadowTint": [
      0.12,
      0.08,
      0.22
    ],
    "shadowTintAmount": 0.2,
    "highlightTint": [
      0.92,
      0.86,
      0.98
    ],
    "highlightTintAmount": 0.06,
    "saturation": 0.8,
    "contrast": 1.2,
    "lift": -0.02,
    "vignette": 0.3
  },
  "requiresSecret": true,
  "finalFloor": {
    "bossId": "umbral_hierarch",
    "arenaHazards": [
      {
        "scene": "res://scenes/traps/shadow_trap.tscn",
        "count": 6,
        "radius": 10,
        "lifetime": 20
      }
    ],
    "arenaAdds": [
      {
        "enemyId": "umbral_penitent",
        "count": 3,
        "radius": 7
      }
    ],
    "arenaModifier": {
      "damageMult": 1.15
    }
  },
  "maxHeightLevel": 2,
  "maxSecrets": 3,
  "generator": {
    "bossMinDistance": 3,
    "minDeadEnds": 3,
    "branchMaxDepth": 4,
    "maxNeighborCount": 4,
    "loopBudget": 2,
    "maxGenerationAttempts": 256,
    "maxWalkAttempts": 8192,
    "allow2x2Blocks": true,
    "fillBoundingBox": true,
    "corridorRatio": 0.2,
    "floorSilhouette": "cross"
  },
  "lootTablePath": "content/loot/tables/umbral_chapel.json",
  "floorSurface": "wood"
}
