{
  "id": "iron_vault",
  "name": "Iron Vault",
  "templatePrefix": "vault",
  "assetFolder": "vault",
  "roomCount": {
    "min": 8,
    "max": 10
  },
  "roomTemplateIds": [
    "vault_entrance",
    "vault_stairs",
    "vault_corridor",
    "vault_courtyard",
    "vault_hall",
    "vault_treasure",
    "vault_secret",
    "vault_arena",
    "vault_boss",
    "vault_puzzle",
    "vault_corridor_long",
    "vault_corridor_bend",
    "vault_balcony"
  ],
  "materials": {
    "floor": "vault",
    "wall": "vault",
    "ceiling": "vault",
    "accent": "vault"
  },
  "lighting": {
    "ambientColor": [
      0.4,
      0.35,
      0.32
    ],
    "ambientEnergy": 0.45,
    "fogEnabled": true,
    "fogColor": [
      0.12,
      0.1,
      0.08
    ],
    "fogDensity": 0.018,
    "torchColor": [
      0.95,
      0.65,
      0.35
    ],
    "torchEnergy": 2
  },
  "audioProfile": "content/audio_profiles/iron_vault.json",
  "propKit": {
    "pillar": "res://scenes/props/vault/pillar.tscn",
    "sconce": "res://scenes/props/vault/sconce.tscn",
    "rubble": [
      "res://scenes/props/vault/rubble_a.tscn",
      "res://scenes/props/vault/rubble_b.tscn"
    ]
  },
  "enemyPool": [
    {
      "enemyId": "iron_ratchet",
      "weight": 3,
      "minFloor": 1
    },
    {
      "enemyId": "iron_needle",
      "weight": 2,
      "minFloor": 1
    },
    {
      "enemyId": "iron_sentinel",
      "weight": 2,
      "minFloor": 2
    },
    {
      "enemyId": "iron_bellows_golem",
      "weight": 2,
      "minFloor": 3
    },
    {
      "enemyId": "iron_foreman",
      "weight": 1,
      "minFloor": 3
    }
  ],
  "roleComposition": {
    "melee": 0.5,
    "ranged": 0.2,
    "shield": 0.3
  },
  "bossPool": [
    {
      "enemyId": "iron_conclave",
      "weight": 3
    },
    {
      "enemyId": "iron_foreman",
      "weight": 1
    }
  ],
  "minibossPool": [
    {
      "enemyId": "iron_foreman",
      "weight": 1
    }
  ],
  "budgets": {
    "baseEnemyThreat": 100,
    "baseLootValue": 60,
    "threatPerTier": 20,
    "lootPerTier": 10
  },
  "lootTables": {
    "treasure": [
      {
        "itemId": "health_potion",
        "quantity": [
          2,
          3
        ],
        "weight": 3
      },
      {
        "itemId": "stone_relic_heart",
        "quantity": [
          1,
          1
        ],
        "weight": 2
      }
    ],
    "secret": [
      {
        "itemId": "stone_relic_heart",
        "quantity": [
          1,
          1
        ],
        "weight": 2
      },
      {
        "itemId": "health_potion",
        "quantity": [
          4,
          5
        ],
        "weight": 3
      }
    ],
    "side": [
      {
        "itemId": "swift_step_charm",
        "quantity": [
          1,
          1
        ],
        "weight": 2
      }
    ],
    "armory": [
      {
        "itemId": "war_hammer",
        "quantity": [
          1,
          1
        ],
        "weight": 1
      }
    ]
  },
  "trapPool": [
    {
      "trapId": "spike_trap",
      "weight": 3
    },
    {
      "trapId": "swinging_blade",
      "weight": 3
    },
    {
      "trapId": "ember_grate",
      "weight": 2
    },
    {
      "trapId": "arrow_line",
      "weight": 2
    },
    {
      "trapId": "collapsing_floor",
      "weight": 2
    }
  ],
  "requiresSecret": true,
  "finalFloor": {
    "bossId": "iron_conclave",
    "arenaHazards": [
      {
        "scene": "res://scenes/bosses/arena_hazard.tscn",
        "count": 6,
        "radius": 10,
        "lifetime": 20
      }
    ],
    "arenaAdds": [
      {
        "enemyId": "iron_needle",
        "count": 3,
        "radius": 7
      }
    ],
    "arenaModifier": {
      "poiseMult": 1.2,
      "damageMult": 1.1
    }
  },
  "maxHeightLevel": 2,
  "maxSecrets": 3,
  "generator": {
    "bossMinDistance": 3,
    "minDeadEnds": 3,
    "branchMaxDepth": 4,
    "maxNeighborCount": 4,
    "loopBudget": 2,
    "maxGenerationAttempts": 256,
    "maxWalkAttempts": 8192,
    "allow2x2Blocks": true,
    "fillBoundingBox": true,
    "corridorRatio": 0.2,
    "floorSilhouette": "cross"
  },
  "grade": {
    "shadowTint": [
      0.16,
      0.12,
      0.1
    ],
    "shadowTintAmount": 0.24,
    "highlightTint": [
      1,
      0.8,
      0.54
    ],
    "highlightTintAmount": 0.2,
    "saturation": 0.88,
    "contrast": 1.16,
    "lift": -0.01,
    "vignette": 0.28
  },
  "lootTablePath": "content/loot/tables/iron_vault.json",
  "floorSurface": "stone"
}
