{
  "id": "crystal_caverns",
  "name": "Crystal Caverns",
  "templatePrefix": "crystal",
  "assetFolder": "crystal",
  "roomCount": {
    "min": 8,
    "max": 10
  },
  "roomTemplateIds": [
    "crystal_entrance",
    "crystal_stairs",
    "crystal_corridor",
    "crystal_courtyard",
    "crystal_hall",
    "crystal_treasure",
    "crystal_secret",
    "crystal_arena",
    "crystal_boss",
    "crystal_puzzle",
    "crystal_corridor_long",
    "crystal_corridor_bend",
    "crystal_balcony"
  ],
  "materials": {
    "floor": "crystal",
    "wall": "crystal",
    "ceiling": "crystal",
    "accent": "crystal"
  },
  "lighting": {
    "ambientColor": [
      0.35,
      0.5,
      0.75
    ],
    "ambientEnergy": 0.55,
    "fogEnabled": true,
    "fogColor": [
      0.12,
      0.2,
      0.35
    ],
    "fogDensity": 0.02,
    "torchColor": [
      0.65,
      0.82,
      0.95
    ],
    "torchEnergy": 2
  },
  "audioProfile": "content/audio_profiles/crystal_caverns.json",
  "propKit": {
    "pillar": "res://scenes/props/crystal/pillar.tscn",
    "sconce": "res://scenes/props/crystal/sconce.tscn",
    "rubble": [
      "res://scenes/props/crystal/rubble_a.tscn",
      "res://scenes/props/crystal/rubble_b.tscn"
    ]
  },
  "enemyPool": [
    {
      "enemyId": "crystal_crawler",
      "weight": 3,
      "minFloor": 1
    },
    {
      "enemyId": "crystal_spitter",
      "weight": 2,
      "minFloor": 1
    },
    {
      "enemyId": "crystal_golem",
      "weight": 2,
      "minFloor": 2
    },
    {
      "enemyId": "crystal_shade",
      "weight": 2,
      "minFloor": 3
    },
    {
      "enemyId": "miniboss_crystal_guardian",
      "weight": 1
    }
  ],
  "roleComposition": {
    "melee": 0.4,
    "ranged": 0.6
  },
  "bossPool": [
    {
      "enemyId": "boss_crystal_sovereign",
      "weight": 3
    },
    {
      "enemyId": "miniboss_crystal_guardian",
      "weight": 1
    }
  ],
  "minibossPool": [
    {
      "enemyId": "miniboss_crystal_guardian",
      "weight": 1
    }
  ],
  "budgets": {
    "baseEnemyThreat": 100,
    "baseLootValue": 60,
    "threatPerTier": 20,
    "lootPerTier": 10
  },
  "lootTables": {
    "treasure": [
      {
        "itemId": "health_potion",
        "quantity": [
          2,
          3
        ],
        "weight": 3
      },
      {
        "itemId": "wind_relic_charm",
        "quantity": [
          1,
          1
        ],
        "weight": 2
      }
    ],
    "secret": [
      {
        "itemId": "wind_relic_charm",
        "quantity": [
          1,
          1
        ],
        "weight": 2
      },
      {
        "itemId": "health_potion",
        "quantity": [
          3,
          4
        ],
        "weight": 3
      }
    ],
    "side": [
      {
        "itemId": "crystal_shard_blade",
        "quantity": [
          1,
          1
        ],
        "weight": 2
      },
      {
        "itemId": "flame_relic_core",
        "quantity": [
          1,
          1
        ],
        "weight": 2
      }
    ],
    "armory": [
      {
        "itemId": "crystal_shard_blade",
        "quantity": [
          1,
          1
        ],
        "weight": 1
      }
    ]
  },
  "trapPool": [
    {
      "trapId": "spike_trap",
      "weight": 3
    },
    {
      "trapId": "falling_trap",
      "weight": 2
    },
    {
      "trapId": "collapsing_floor",
      "weight": 2
    },
    {
      "trapId": "arrow_line",
      "weight": 1
    },
    {
      "trapId": "gas_vent",
      "weight": 1
    }
  ],
  "requiresSecret": true,
  "finalFloor": {
    "bossId": "boss_crystal_sovereign",
    "arenaHazards": [
      {
        "scene": "res://scenes/bosses/crystal_pillar_hazard.tscn",
        "count": 6,
        "radius": 10,
        "lifetime": 20
      }
    ],
    "arenaAdds": [
      {
        "enemyId": "crystal_wisp",
        "count": 3,
        "radius": 7
      }
    ],
    "arenaModifier": {
      "damageMult": 1.15,
      "moveSpeedMult": 1.05
    }
  },
  "maxHeightLevel": 1,
  "maxSecrets": 2,
  "generator": {
    "bossMinDistance": 3,
    "minDeadEnds": 3,
    "branchMaxDepth": 4,
    "maxNeighborCount": 4,
    "loopBudget": 2,
    "maxGenerationAttempts": 256,
    "maxWalkAttempts": 8192,
    "allow2x2Blocks": true,
    "fillBoundingBox": false,
    "corridorRatio": 0.05
  },
  "grade": {
    "shadowTint": [
      0.1,
      0.16,
      0.3
    ],
    "shadowTintAmount": 0.26,
    "highlightTint": [
      0.78,
      0.94,
      1
    ],
    "highlightTintAmount": 0.18,
    "saturation": 1.08,
    "contrast": 1.12,
    "lift": 0.01,
    "vignette": 0.24
  },
  "lootTablePath": "content/loot/tables/crystal_caverns.json",
  "floorSurface": "stone"
}
