{
  "id": "prism_depths",
  "name": "Prism Depths",
  "templatePrefix": "prism",
  "assetFolder": "prism",
  "roomCount": {
    "min": 8,
    "max": 10
  },
  "roomTemplateIds": [
    "prism_entrance",
    "prism_stairs",
    "prism_corridor",
    "prism_courtyard",
    "prism_hall",
    "prism_treasure",
    "prism_secret",
    "prism_arena",
    "prism_boss",
    "prism_puzzle",
    "prism_corridor_long",
    "prism_corridor_bend",
    "prism_balcony"
  ],
  "materials": {
    "floor": "prism",
    "wall": "prism",
    "ceiling": "prism",
    "accent": "prism"
  },
  "lighting": {
    "ambientColor": [
      0.42,
      0.58,
      0.82
    ],
    "ambientEnergy": 0.58,
    "fogEnabled": true,
    "fogColor": [
      0.15,
      0.25,
      0.42
    ],
    "fogDensity": 0.022,
    "torchColor": [
      0.75,
      0.85,
      1
    ],
    "torchEnergy": 2.1
  },
  "audioProfile": "content/audio_profiles/prism_depths.json",
  "propKit": {
    "pillar": "res://scenes/props/prism/pillar.tscn",
    "sconce": "res://scenes/props/prism/sconce.tscn",
    "rubble": [
      "res://scenes/props/prism/rubble_a.tscn",
      "res://scenes/props/prism/rubble_b.tscn"
    ]
  },
  "enemyPool": [
    {
      "enemyId": "prism_shardling",
      "weight": 3,
      "minFloor": 1
    },
    {
      "enemyId": "prism_lantern",
      "weight": 2,
      "minFloor": 1
    },
    {
      "enemyId": "prism_refractor",
      "weight": 2,
      "minFloor": 2
    },
    {
      "enemyId": "prism_facet_golem",
      "weight": 2,
      "minFloor": 3
    },
    {
      "enemyId": "prism_cantor",
      "weight": 1,
      "minFloor": 3
    }
  ],
  "roleComposition": {
    "melee": 0.4,
    "ranged": 0.6
  },
  "bossPool": [
    {
      "enemyId": "prism_choirmaster",
      "weight": 3
    },
    {
      "enemyId": "prism_cantor",
      "weight": 1
    }
  ],
  "minibossPool": [
    {
      "enemyId": "prism_cantor",
      "weight": 1
    }
  ],
  "budgets": {
    "baseEnemyThreat": 100,
    "baseLootValue": 60,
    "threatPerTier": 20,
    "lootPerTier": 10
  },
  "lootTables": {
    "treasure": [
      {
        "itemId": "health_potion",
        "quantity": [
          2,
          3
        ],
        "weight": 3
      },
      {
        "itemId": "wind_relic_charm",
        "quantity": [
          1,
          1
        ],
        "weight": 2
      }
    ],
    "secret": [
      {
        "itemId": "wind_relic_charm",
        "quantity": [
          1,
          1
        ],
        "weight": 2
      },
      {
        "itemId": "health_potion",
        "quantity": [
          3,
          4
        ],
        "weight": 3
      }
    ],
    "side": [
      {
        "itemId": "crystal_shard_blade",
        "quantity": [
          1,
          1
        ],
        "weight": 2
      },
      {
        "itemId": "flame_relic_core",
        "quantity": [
          1,
          1
        ],
        "weight": 2
      }
    ],
    "armory": [
      {
        "itemId": "crystal_shard_blade",
        "quantity": [
          1,
          1
        ],
        "weight": 1
      }
    ]
  },
  "trapPool": [
    {
      "trapId": "spike_trap",
      "weight": 2
    },
    {
      "trapId": "arrow_line",
      "weight": 3
    },
    {
      "trapId": "collapsing_floor",
      "weight": 2
    },
    {
      "trapId": "swinging_blade",
      "weight": 2
    },
    {
      "trapId": "gas_vent",
      "weight": 1
    }
  ],
  "requiresSecret": true,
  "finalFloor": {
    "bossId": "prism_choirmaster",
    "arenaHazards": [
      {
        "scene": "res://scenes/bosses/crystal_pillar_hazard.tscn",
        "count": 6,
        "radius": 10,
        "lifetime": 20
      }
    ],
    "arenaAdds": [
      {
        "enemyId": "prism_lantern",
        "count": 3,
        "radius": 7
      }
    ],
    "arenaModifier": {
      "attackCooldownMult": 0.9
    }
  },
  "maxHeightLevel": 2,
  "maxSecrets": 3,
  "generator": {
    "bossMinDistance": 3,
    "minDeadEnds": 3,
    "branchMaxDepth": 4,
    "maxNeighborCount": 4,
    "loopBudget": 2,
    "maxGenerationAttempts": 256,
    "maxWalkAttempts": 8192,
    "allow2x2Blocks": true,
    "fillBoundingBox": false,
    "corridorRatio": 0.1
  },
  "grade": {
    "shadowTint": [
      0.16,
      0.1,
      0.28
    ],
    "shadowTintAmount": 0.22,
    "highlightTint": [
      0.72,
      0.96,
      1
    ],
    "highlightTintAmount": 0.22,
    "saturation": 1.18,
    "contrast": 1.1,
    "lift": 0.02,
    "vignette": 0.22
  },
  "lootTablePath": "content/loot/tables/prism_depths.json",
  "floorSurface": "stone"
}
